link,content
https://www.investing.com/news/economy/wall-street-strategists-rush-to-adjust-fed-calls-after-a-weak-jobs-report-3552611,"The latest Non-Farm Payrolls (NFP) report revealed a gain of 114,000 jobs in the past month, falling short of economists' expectations and sending stocks lower. The figure indicates a slowdown in job creation compared to previous months, raising concerns about the strength of the labor market. Additionally, the unemployment rate ticked up to 4.3%, marking an increase that suggests a cooling job market. The combination of fewer jobs added, and a rising unemployment rate has sparked worries about potential economic deceleration. In response to the disappointing NFP numbers, stock markets experienced a notable decline, with the Nasdaq down more than 3%, the declining over 2%, and the Dow down around 1.5% at the time of writing. Investors reacted swiftly to the weaker-than-expected employment data, fearing it could signal broader economic challenges ahead. The drop in stock prices reflects heightened anxiety about the future pace of economic growth. What analysts are saying after NFP BofA: Bank of America said in its note reacting to the report that the “softer-than-expected July employment report on the heels of other soft data like the ISM manufacturing report helps to lock-in a rate cut in September.” “That said, we continue to project a gradual pace of easing,” they added. “In making this change, we also reduce our outlook for the terminal rate in the upcoming normalization cycle. We reduce it by 25bp to 3.25-3.5%. If the economy is cooling faster than we or the Fed anticipated, then it would point to a lower need for a higher-for-longer policy stance.” Evercore ISI: Evercore said the NFP number came in significantly weaker than it had expected. “The labor data is now in the driving seat,” said the firm. “Following this report we think the Fed will cut at least three times in 2024 – September, November and December – in a more front-loaded effort to secure the soft landing.” Furthermore, they think it is now realistic to expect the first move to be a 50bp cut in September. “We reiterate [that] if the Fed ever did see evidence that the labor market is cracking, it would go fast and hard, cutting by 200-250bp by year-end,” they concluded. Jefferies: The firm said the data gives the Fed an opening to cut in September. “We are adjusting our call to reflect a 25 bp cut in September and another one following in December. Past that, we think the Fed has to slide into ‘wait and see’ mode,” said Jefferies. The firm continues to believe that pricing in more than two cuts before December 2024 and more than four total cuts before December 2025 is a bet on a recession, and they “do not think that there's any evidence that a recession is imminent.” Piper Sandler: “To us, this suggests that we’ve hit the mark where lower rates no longer a bullish catalyst for stocks,” said analysts at Piper Sandler. “We expect that we will see a positive correlation between interest rates and stock prices going forward.” BMO Capital: BMO highlighted that following the data, “the Sahm Rule Recession Indicator breached the 0.50 threshold that has historically signaled the US economy is in the early stages of a recession.” “We're cognizant that there is plenty of data yet to come between now and the September 18th meeting -- although if this trend in employment accelerates in August, the argument for a 50 bp cut becomes more compelling.” said BMO, adding that they are still in the 25 bp camp at the moment."
https://www.investing.com/news/economy-news/explainercharting-the-feds-economic-data-flow-3552323,"(Reuters) -The Federal Reserve held its benchmark overnight interest rate steady in the 5.25%-5.50% range at the conclusion of its July 30-31 policy meeting, but also signaled that rate cuts may begin as soon as the U.S. central bank's meeting in September. The decision will hinge on data between now and then. Among the key statistics the U.S. central bank is watching: EMPLOYMENT (Released Aug 2; next release Sept. 6): U.S. firms added an underwhelming 114,000 jobs in July, and revisions to the prior two months knocked 29,000 positions from the previously estimated number of payroll jobs. That pushed the three-month average total payroll growth down to 170,000, below the level typical before the COVID-19 pandemic. The unemployment rate also rose to 4.3%, which could heighten fears that the labor market is deteriorating and potentially making the economy vulnerable to a recession. The number of people in a job or looking for work grew. Government data in late July showed the slowing of the labor market is being driven by low hiring, rather than layoffs, with hires dropping to a four-year low in June. Average hourly wages rose 3.6% in July compared to a year ago, versus a 3.8% annual increase in June. The Fed generally considers wage growth in the range of 3.0%-3.5% as consistent with its 2% inflation target. JOB OPENINGS (Released July 30; next release Sept. 4): In a sign of the job market's continued resilience, the level of job openings remained above 8 million in June, while the number of open jobs available for each unemployed person fell slightly to 1.2, remaining roughly where it was in the years before the pandemic. Fed Chair Jerome Powell has kept a close eye on the U.S. Labor Department's Job Openings and Labor Turnover Survey (JOLTS) for information on the imbalance between labor supply and demand, and the pandemic-era jump to more than 2 to 1 in the number of open jobs for each available worker was emblematic of the time. Things have cooled substantially. Other aspects of the survey, like the quits rate, now down to 2.1, have edged back to pre-pandemic levels in what Fed officials view as an emerging balance between the supply and demand for workers. While the hiring rate has slowed, for example, the layoff rate has remained stable in a sign of companies holding on to workers. INFLATION (PCE released July 26; next release CPI Aug. 14): The personal consumption expenditures price index, used by the Fed to set its 2% inflation target, shows inflation slowly subsiding. It fell in June to a 2.5% annual rate, from 2.6% in the prior month. Core PCE prices, stripped of volatile food and energy costs, remained unchanged in June at 2.6%. Despite that reading, the data looks set to help Fed officials build more confidence that inflation is moving toward the U.S. central bank's 2% target. On a month-to-month basis, the PCE index rose 0.1% while core PCE prices edged up 0.2%. Officials have begun to pay closer attention to signs of weakening demand in the economy as a precursor to a slowed pace of price increases. The separate consumer price index fell in June by 0.1%, with drops in both volatile energy items and core consumer goods like vehicles, and weakness in housing costs that Fed officials have long been waiting to see. The 0.2% rise in shelter prices was the slowest since August of 2021, and overall it was the weakest CPI print since May of 2020. The data pushed the annual rise in consumer prices down to 3% from 3.3% in the prior month, with the more volatile core index, excluding food and energy, falling to 3.3% from 3.4%."
https://www.investing.com/news/commodities-news/libyas-70-billion-wealth-fund-sees-thaw-in-un-asset-freeze-by-yearend-3552572,"By Libby George and Marc Jones LONDON (Reuters) - The Libyan Investment Authority is expecting U.N. sign-off by the end of the year to actively manage its $70 billion in assets for the first time in more than a decade, its chief executive told Reuters. The LIA, set up under Muammar Gaddafi in 2006 to manage the country's oil wealth, has been under a United Nations asset freeze since the 2011 revolution that toppled Gaddafi. This means that in order for Africa's largest sovereign wealth fund to make new investments, or even move cash from negative interest rate accounts, where they have been losing money, the LIA needs UN Security Council sign-off. Chief Executive Ali Mahmoud Mohamed said the authority is confident the council will provide the landmark approval by November or December for an investment plan it submitted in March. ""We believe our investment plan with be accepted ... we don't think they will refuse it,"" Mohamed told Reuters via a translator. The first of LIA's four-part plan is the ""very simple"" step of reinvesting money that has built up during the freeze, such as payouts from bond holdings. The LIA has previously tried to actively manage its funds. But in the turmoil following Gaddafi's ouster, it at one point had dueling chairmen, backed by different factions within the country. A British court ruled in 2020 in Mohamed's favor. In 2020, the LIA said a Deloitte audit showed the freeze had cost it some $4.1 billion in potential equity returns. He said transparency has since improved; the LIA released audited financial statements in 2021, covering 2019. It aims to publish the 2020 numbers in the coming months and provide them annually from next year. And while the LIA was 98th out of 100 sovereign funds in a 2020 ranking of sustainability and governance by Global SWF, an industry data specialist, it stood at 51st this year. Of its estimated $70 billion in assets, the fund has $29 billion in global real estate, $23 billion in deposits invested in Europe and Bahrain and $8 billion in equities spread over more than 300 companies around the world. It also has roughly $2 billion worth of matured bonds. The UN Security Council Committee was not immediately available to comment. Last year, after meeting with the LIA, its members ""noted the progress made on the implementation of the LIA's Transformation Strategy"" and stressed ""the importance of guaranteeing the frozen funds for the benefit of the Libyan people."" Mohamed said that it is also planning to request approval this year for two further investment plan ""pillars"" - one that covers its share portfolio and another that relates to domestic investment plan. The LIA is targeting domestic investments in solar power and helping increase oil exports. Libya is one of Africa's largest oil exporters, pumping roughly 1.2 million barrels per day. If the UN does not approve its investment proposals, Mohamed said ""we will keep trying...we will keep asking and requesting."""
https://www.investing.com/news/economy/intel-suspends-dividend-as-q2-results-miss-estimates-on-margin-woes-shares-slump-3550303,"Investing.com -- Intel stock plummeted sharply after the chipmaker on Thursday suspended its dividend and said it expected a loss in the third quarter after reporting Q2 results that fell short of estimates amid margin pressures. Intel Corporation (NASDAQ: ) crashed 27% following the market open on Friday. The company said it was suspending its dividend starting in Q4. Intel Q2 adjusted earnings of $0.02 on revenue of $12.83B, missing Wall Street estimates of $0.10 and $12.93B, respectively. The miss on the top and bottom lines comes as margins were hurt by the ""accelerated ramp of our AI PC product, higher than typical charges related to non-core businesses and the impact from unused capacity,"" the company said. Gross margin fell 0.4% to 35.4%. Looking ahead to Q3, the company guided for an adjusted loss of $0.03 on revenue in a range of $12.5B to $13.5B, confounding analyst estimates for adjusted EPS of $0.31 on revenue of $14.39B. Intel forecast margin in Q3 falling to 34.5% even as it detailed cost-cutting plans including a more than 15% headcount reduction, to resize and refocus. ""Falling share, margin issues, and capex/opex cuts smell more like a spiral as time running out on a solution,"" Jefferies analysts commented in a post-earnings note. ""This is yet another major reset of the story with Client and Servers both well below seasonal and gross margins significantly lower,"" they added, maintaining a Hold rating on the stock and trimming the price target from $34 to $28. Separately, analysts at Raymond James downgraded Intel stock to Market Perform after the report. ""We expected the 3Q outlook to be weak but are surprised by the magnitude, especially on margins,"" they said. ""While management sounded confident about longer-term targets, GM headwinds are expected to persist through 2025, and we see limited incremental revenue drivers near-term,"" Raymond James added in its note. ""As such, we expect profitability to remain under pressure and are moving to the sidelines despite the attractive valuation and our view that an eventual Foundry separation could unlock significant value."" Yasin Ebrahim contributed to this report."
https://www.investing.com/news/economy-news/instant-view-soft-us-payrolls-number-opens-door-to-september-fed-cut-3552269,"(Reuters) - U.S. job growth slowed more than expected in July, while the unemployment rate increased to 4.3%, which could heighten fears that the labor market is deteriorating and potentially making the economy vulnerable to a recession. Nonfarm payrolls increased by 114,000 jobs last month after rising by a downwardly revised 179,000 in June, the Labor said on Friday. Economists polled by Reuters had forecast payrolls advancing by 175,000 jobs after a previously reported 206,000 gain in June. Hurricane Beryl, which knocked out power in Texas and slammed parts of Louisiana during the payrolls survey week, likely contributed to the below-expectations payrolls gain. Traders bet that the Federal Reserve will start easing policy in September with a big half-percentage-point interest rate cut, versus what was seen before the report as a 70% chance of a more usual quarter-point cut. MARKET REACTION: STOCKS: E-minis extended losses and were down 1.69%BONDS: The yield on benchmark U.S. 10-year notes tumbled to 3.835%, the two-year note yield fell to 3.945% FOREX: The extended a loss to -0.7% COMMENTS: MARC OSTWALD, CHIEF ECONOMIST AND GLOBAL STRATEGIST, ADM INVESTOR SERVICES INTERNATIONAL, LONDON ""It was a weak reading. There wasn't really an impact from Hurricane Beryl. You had nice increases in manufacturing, construction and retail and indeed leisure and hospitality - all of which should have been hit if it had. So you can't explain the weak reading with that. The unemployment rate rose, more due to migration than anything else because labor force participation increased, You've got two forces, one of labor demand easing, not falling off a cliff but definitely easing - and a larger labor force."" ""I wouldn't say the Fed's behind the curve - you can't fine tune these things. But this essentially cements a rate cut in September, whatever we get from July CPI."" ""The last thing the stock market needs right now is another definitive signal that the economy is slowing. It's good news for bonds and credit, but not for equities although there are some other factors going on there."" STUART COLE, CHIEF MACRO ECONOMIST, EQUITI CAPITAL, LONDON ""A soft number, which must leave a September cut from the Fed starting to look like a nailed-on certainty. A big miss on the headline number, a sizeable downwards revision to last month’s print, and a 2% rise in the rate of unemployment – it is no surprise that Powell has recently been highlighting concerns among some FOMC members about the dangers of delaying for too long a cut in interest rates, and then going too timidly thereafter."" ""And what is potentially even more worrying for the Fed is that, whereas in the past a softer data would see equities rally on the expectation that inflation was coming down and interest rate cuts were on the horizon, the fact that equities have reacted negatively to today’s number suggests the thinking is that the Fed is already behind the curve and should have been cutting rates already. The two CPI reports to be released between now and the September Fed meeting probably now have to be pretty shocking if the Fed is going to defer cutting rates again."" MELISSA BROWN, MANAGING DIRECTOR, APPLIED RESEARCH, SIMCORP, NEW YORK ""The top line number is a little shocking relative to expectations. It's much lower than expected. But it's a positive number. It's not the lowest we've seen. The job gains could be low enough to trigger the Fed to act at the next meeting but they're not so low that the signs are flashing recession."" ""The unemployment number is higher than expected and higher than its been for a while. That's a bit of a concern but it's still relatively low."" ""There's still a lot of data to come out between now and the next meeting. A 50 basis-point cut is possible but given the Fed's caution, not that likely. It'll really depend on the data over the next few weeks."" ""Hourly earnings was slightly below. What that means is the next inflation report will be quite important, where general inflation stands versus earnings gains,"" ""To me it's a little surprising the market is reacting so badly because at the same time the likelihood of a bigger rate cut has gone up and the market tends to like that."" WASIF LATIF, PRESIDENT AND CHIEF INVESTMENT OFFICER, SARMAYA PARTNERS, PRINCETON, NEW JERSEY “This is what a growth scare looks like. The market is now realizing that the economy is indeed slowing. Unemployment is an auto-correlation number. So once it starts moving in a certain direction, it generally continues to moving that direction for some successive data points. I think the market is also quickly realizing the Fed may have made a mistake by not cutting. Historically, the Fed has been that they have tended to wait longer and end up pushing the economy into a slower zone. Obviously, they've been data dependent. But now that the data's out, they will probably do what they need to do in September. But September is a lifetime away right now for the market, which is panicking.” “You would expect bonds to rally in this environment because of the economic slowdown, the flight to quality etc. But you're also seeing gold hitting all-time highs the because now we're at a point where the market is pricing in greater Fed cuts and I think the gold price is saying that's all well and good.” BRIAN JACOBSEN, CHIEF ECONOMIST, ANNEX WEALTH MANAGEMENT, MENOMONEE FALLS, WISCONSIN “If Powell knew then what he knows now, he probably would have cut rates. By keeping rates on hold while inflation fell, they’ve applied too much pressure on the brakes. The decline in hours for the manufacturing work week is not a good sign for this being just a soft patch. The Fed can’t bank on economic momentum bailing them out from being too slow to recognize how quickly things are changing.”"
https://www.investing.com/news/economy-news/no-room-for-russia-to-cut-rates-this-year-as-inflation-climbs-economy-overheats-reuters-poll-3552325,"By Alexander Marrow (Reuters) - Russia's central bank has no room to lower rates from 18% this year, a Reuters poll showed on Friday, with analysts forecasting inflation above the bank's 4% target in an overheating economy propelled by military production and consumer spending. Russia's economic growth relies heavily on large-scale government spending on arms production as Moscow funds its war in Ukraine, contributing to soaring real wages in a tight labour market with unemployment at a record low. The consensus forecast of 14 analysts polled by Reuters in late July and early August suggested the Bank of Russia's key rate would end the year at 18%, up from 17.75% in the previous poll. The central bank warned of economic overheating as it hiked rates to 18% last week, vowing to bring down stubborn inflation, currently running at about 9%. Mikhail Vasilyev, chief analyst at Sovcombank, was one of four economists expecting tighter monetary policy by year-end, predicting another hike, in September or October, to 20%. ""We believe that the opportunity for a key rate cut will open up only in mid-2025, when inflation will steadily slow towards the 4% target,"" Vasilyev said. Analysts forecast year-end inflation sharply higher at 6.9%, up from 6.4% in last month's poll. That would follow annual inflation of 7.4% in 2023 and 11.9% in 2022. Expectations for Russia's 2024 gross domestic product growth were also markedly raised to 3.6% from 3.1% in the previous poll, as Russian government and consumer spending remains strong. GDP grew 4.7% in the first half of the year, the economy ministry estimated this week. The rouble, currently buttressed by capital controls, state foreign currency interventions, high rouble interest rates and oil prices, is seen weakening to 96.1 to the dollar over the next year, slightly stronger than in the previous poll. (Reporting and polling by Alexander Marrow in London; Editing by Helen Popper)"
