link,content
https://www.investing.com/news/economy-news/us-30year-mortgage-slides-to-lowest-since-february-freddie-mac-says-3550012,"By Makailah Gause NEW YORK (Reuters) - The average rate on the popular U.S. 30-year mortgage rate fell to 6.73% this week, its lowest level since February as the bond market reacted to signs of cooling inflation. The 30-year fixed-rate mortgage was 5 basis points lower than a week earlier when it averaged 6.78%, mortgage finance giant Freddie Mac said on Thursday. It averaged 6.90% during the same period a year ago. ""Apprehension in consumer confidence may prevent an immediate uptick as affordability challenges remain top of mind,"" Chief Economist Sam Khater said in a statement. But, he said, data showing a moderation in home price growth and increasing housing inventory are positive signs for prospective home buyers. House prices increased 5.7% year-on-year in May, the smallest annual increase in 10 months as still-high mortgage rates then kept a lid on demand, the Federal Housing Finance Agency said Tuesday. More recently, though, pending home sales surged 4.8% in June from a month earlier, helped by the recent increase in homes for sale, the National Association of Realtors said on Wednesday. Still, even with home loan rates now more than 1 percentage point below their peak levels from last year, mortgage application volumes remain subdued. ""Many borrowers may be hoping and waiting for mortgage rates to decline even further, which is what we expect to happen once the Federal Reserve begins to cut short-term rates,"" Mortgage Bankers Association Chief Executive Bob Broeksmit said in a statement. If inflation continues to cool, the Fed could cut interest rates as soon as September, Chair Jerome Powell said Wednesday."
https://www.investing.com/news/commodities-news/canadian-union-unifor-calls-for-strict-tariffs-on-imported-chinese-evs-components-3549922,"By Divya Rajagopal TORONTO (Reuters) - Canadian labour union Unifor called on the federal government on Thursday to impose tariffs on all Chinese-made electric vehicles (EVs), EV batteries and other components, aligning it with some of the measures already proposed by the United States. In July, Canada began a public consultation process as it weighs imposing tariffs on Chinese-made electric vehicles, following similar moves by the United States and European Union. The Canadian government has said it sees ""a risk that China's unfair support for the EV sector, if left unchecked, could lead to an exponential surge of imports that will adversely affect planned EV investments and the transformation of Canada's automotive sector."" The public consultation process is set to end this week. ""The United States and the European Union have responded proactively to the threat posed by unfair imports and now it's time for Canada to do the same,"" Unifor, Canada's largest union representing private-sector workers, said on Thursday. Unifor has demanded that Ottawa impose a surtax above the existing tariff rates of 100% on Chinese-made electric vehicles, and a surtax of 25% on batteries, as well as tariffs on electric motors and battery cell materials. Even as Canada examines possible tariffs, Chinese automaker BYD (SZ: ), one of the world's biggest EV manufacturers, recently met with the Canadian government to discuss the potential application of tariffs on EVs, and its plans to begin selling passenger EVs in Canada."
https://www.investing.com/news/economy-news/leisure-vehicle-makers-feel-the-heat-this-summer-as-bigticket-spending-cools-3549908,"By Savyata Mishra (Reuters) - Makers of ATVs, boats and other recreational vehicles are staring at a bleak summer as caution around big-ticket purchases amid high interest rates has dashed hopes of a demand recovery for big manufacturers of leisure products. In the wake of the coronavirus pandemic, consumers with money to spend took advantage of low rates to buy goods many refer to as ""adult toys"" - motorcycles, boats, RVs and other vehicles that cost a lot and are often financed through loans. The shine came off some of the companies when people returned to international travel, but now with consumer spending slipping, makers of the discretionary items are feeling the pain. Retail sales in the recreational vehicle industry for June and July were slightly worse than what dealers experienced in May, D.A. Davidson analyst Brandon Rolle said. Late last month, shares of motorboats maker Brunswick (NYSE: ) and snowmobiles manufacturer Polaris (NYSE: ) slumped after they slashed annual forecasts after reporting a drop in second-quarter sales and profit. ""Consumers are either maxed out or banks are hesitant to lend at these elevated levels. All these factors have negatively impacted the industry retail environment and resulted in a need to lower inventory of dealerships,"" Polaris CEO Mike Speetzen said on a post-earnings call. Brunswick expects U.S. powerboat sales to a decline of around 10% after posting a 15% drop in sales during the second quarter, normally its peak selling season. Several brokerages have lowered their price targets on Brunswick and Polaris after their results. (NYSE: ) also trimmed its full-year forecast and said it expects weakness to continue into 2025 as dealers are wary of excess inventory. The Canadian powersports firm BRP (NASDAQ: ), which reported results in May, also pruned its annual outlook, despite its first-quarter profit beating estimates. ""With no signs of a seasonal uptick in demand so far, 2024 will almost certainly be a lost year and prospects for 2025 are now coming into question,"" Roth MKM analyst Scott Stember said about Brunswick. Most companies took steps to reduce inventory. Harley-Davidson (NYSE: ) cut dealer inventories by 30% and said it hopes retail and wholesale inventory will be balanced by the end of the year. ""It's not just about the fact that financing the purchase is more expensive overall, that budget suppression ...and interest rates on other finance purchases, not to mention the fact that there's a confidence issue there,"" Brunswick CEO David Foulkes said. So far this year, Polaris, Brunswick and Thor stocks have lost between 12% and 16% of their value. Harley-Davidson was up 2% and BRP 4%."
https://www.investing.com/news/economy-news/german-finance-ministry-advisory-board-doubtful-about-efforts-to-reduce-budget-gap-3549705,"By Maria Martinez BERLIN (Reuters) -The advisory board to the German Finance Ministry sees the three options under consideration to reduce a 17 billion euro ($18 billion) budget shortfall as problematic, according to a letter seen by Reuters on Thursday. The German cabinet passed its 2025 budget in July after months of political wrangling. German Finance Minister Christian Lindner told a news conference that the government was looking at innovative ways to reduce the shortfall. The options under scrutiny are using extra funds from state bank KfW, as well as converting the grants of Germany's national rail operator Deutsche Bahn and the country's highway company into loans. The advisory board to the ministry expressed doubts about these options, arguing that they could put at risk the constitutionally enshrined debt brake. Lindner said, when presenting the budget, the constitutionality of these options was being studied. The government is trying to avoid the chaos of November 2023, when a court ruling blew a 60-billion-euro hole in the public finances and threw the government's financing framework into turmoil. Negotiations on the financing of the 2025 federal budget must therefore continue in the German coalition. Finance ministry sources said that suspending the debt brake, which restricts public borrowing to 0.35% of gross domestic product, is not an option ""constitutionally or economically."" ($1 = 0.9270 euros)"
https://www.investing.com/news/economy-news/uk-firms-scale-back-expected-wage-growth-boe-survey-shows-3549679,"LONDON (Reuters) - British businesses' expectations for wage growth in the next 12 months cooled slightly in July, according to a survey that could help ease the concerns of Bank of England policymakers who are tasked with keeping inflation on target. Expectations for wage growth over the coming year in the BoE's Decision Maker Panel survey fell to 4.1% in the three months to July from 4.2% in the three months June, while on a single-month basis, the measure ticked up slightly to 4.1% from 4.0%. Rob Wood, chief UK economist at Pantheon Macroeconomics, said easing inflation and recruitment difficulties will help slow wages more decisively in the second half of the year. ""Inflation, wage growth, inflation expectations, recruitment difficulties and employment growth have all eased since the MPC raised rates to their peak, suggesting tight monetary policy is working,"" Wood said. ""But there are also enough signals for us to expect wage growth and inflation to linger above target consistent rates for longer than the MPC expects."" On Thursday, the BoE cut interest rates to 5%, down from a 16-year high of 5.25%. It was the first time the central bank cut rates since March 2020, the start of the COVID-19 pandemic, but Governor Andrew Bailey said the BoE was not committing to a series of quick reductions in borrowing costs. Firms surveyed by the BoE expected to raise their own selling prices in the year ahead by less than in the previous survey."
https://www.investing.com/news/economy-news/tech-giants-faced-major-market-cap-drop-in-july-on-earnings-worries-3549663,"(Reuters) - Global mega tech companies' market capitalisation dropped sharply in July, in response to disappointing quarterly results and concerns over high valuations, prompting investors to shift their focus away from the AI sector. In the first half of 2024, investors pushed tech stocks higher on expectations that AI advancements would boost earnings. But the second-quarter earnings reports from tech companies have raised concerns that investment in AI infrastructure has led to ballooning costs with only modest gains. Microsoft (NASDAQ: ) reported revenue that fell short of analysts' expectations, while Tesla (NASDAQ: ) reported its lowest profit margin in more than five years. Additionally, Google's parent company, Alphabet (NASDAQ: ), experienced a slowdown in advertising sales at YouTube, raising concerns about Alphabet's ability to expand its margins. Microsoft and Alphabet's market capitalisations fell by about 6% to $3.1 trillion and $2.1 trillion, respectively, at the end of July, based on LSEG data. Slowing profits among its major customers dampened growth expectations for chipmaker Nvidia (NASDAQ: ), leading to a 5.2% reduction in its market cap to $2.8 trillion. This downturn also impacted its Taiwanese production partner TSMC, the world's largest third-party microchip foundry, which experienced a 4.3% decrease in market cap to $737.8 billion at the end of July. Bucking the trend, Apple (NASDAQ: )'s market cap surged 5.4% to $3.4 trillion at the end of July, fuelled by optimism that its new AI initiative, Apple Intelligence, would boost sales and encourage customers to upgrade their devices to utilize the new technology. But then Nvidia added about $330 billion in stock market value on Wednesday, a record one-day gain for any company on Wall Street after Microsoft and Advanced Micro Devices (NASDAQ: ) reignited the AI rally. Outside the tech sector, drug maker Eli Lilly (NYSE: )'s market capitalisation fell 11.2% to $764.3 billion, amid concerns about its lead in the anti-obesity market being challenged by a promising experimental pill from rival Roche. Despite weak results, Tesla's market cap increased by 17.2% to $740.1 billion, buoyed by optimism about its future growth prospects. Morgan Stanley named Tesla the most valuable automaker its ""top pick"" in the U.S. automotive industry, replacing Ford (NYSE: ) and predicted that Tesla's energy business could eventually surpass its auto business in value."
https://www.investing.com/news/economy-news/bank-of-england-cuts-rates-from-16year-high-careful-on-future-moves-3548419,"By David Milliken, Andy Bruce and Suban Abdulla LONDON (Reuters) - The Bank of England cut interest rates from a 16-year high on Thursday after a tight vote by its policymakers who were split over whether inflation pressures had eased sufficiently. Governor Andrew Bailey led the 5-4 decision to reduce rates by a quarter-point to 5% and he said the BoE would move cautiously going forward. It was the central bank's first cut since March 2020, at the start of the COVID-19 pandemic, giving Britain's new government a boost as it seeks to speed up the pace of economic growth. But Bailey stressed the BoE was not committing to a series of quick reductions in borrowing costs. ""We need to make sure make sure inflation stays low, and be careful not to cut interest rates too quickly or by too much,"" he said in a statement. Most economists polled by Reuters had expected a cut while financial markets had seen just over a 60% chance. Sterling slipped to its lowest against the U.S. dollar since early July and bond yields also fell slightly after the BoE's announcement with the yield on 10-year gilts touching its lowest since March. Bailey insisted the BoE would take its decisions on rates ""from meeting to meeting"" but investors were betting on another rate cut this year with the chance of a move at its next meeting in September seen as a roughly 55% probability. ""The Bank of England is staying tight-lipped on when it expects to cut rates again,"" ING economist James Smith said. ""But we think better news on services inflation and wage growth can unlock one, or more likely two rate cuts by year-end."" Borrowing costs had been on hold for almost a full year - the longest period they have been left unchanged at the peak of a BoE tightening cycle since 2001. In June, the BoE's Monetary Policy Committee voted 7-2 to keep rates on hold. Minutes of the August meeting showed the decision to cut them was ""finely balanced"" for some members. None of the policymakers whose votes changed the balance - Bailey and Deputy Governors Sarah Breeden and new MPC member Clare Lombardelli - had spoken publicly about monetary policy since June. Speaking opportunities had been limited by the July 4 election which brought the Labour Party to power. The BoE said policymakers had been briefed on this week's announcements of big public-sector pay increases and on fiscal policy, but their impact would only be incorporated into the BoE's forecasts after the Oct. 30 budget. Finance minister Rachel Reeves welcomed the rate cut but said millions of families still faced higher mortgage rates and she reiterated her plan to ""fix the foundations of our economy after years of low growth."" British consumer price inflation returned to the BoE's 2% target in May and stayed there in June, down from a 41-year high of 11.1% struck in October 2022. This leaves British inflation lower than in the euro zone - where the European Central Bank cut rates in June - and the United States, where on Wednesday the Federal Reserve opened the door to a September cut. INFLATION TO RISE The BoE expects headline inflation to rise to 2.75% in the final quarter of 2024 as the effect of steep falls in energy prices fades, before returning to its 2% target in early 2026 and later sinking below. The long time lags for interest rates to affect inflation mean the BoE is more focused on what it sees as medium-term drivers of inflation: services prices, wage growth and tightness in the labour market. The BoE linked June's strong services inflation to ""volatile components"" and regulated prices that were influenced by high headline CPI earlier in the year. Wage growth at nearly 6% is almost double the rate the BoE views as consistent with 2% inflation but is slowing in line with the central bank's expectations. The BoE now thinks Britain's economy will expand by around 1.25% this year, up from a previous forecast of 0.5%, after stronger-than-expected growth earlier this year. Based on International Monetary Fund forecasts, that would be stronger growth than in France, Italy and Germany. Surveys of businesses published earlier on Thursday suggested growth in Britain last month was stronger than in much of the euro zone and Asia. The BoE said unemployment will rise slightly, reducing upward pressure on inflation. However, it acknowledged the risk that price pressures might prove more persistent and keep inflation above target for longer than its main forecast. Next month the BoE must decide whether it continues the annual 100 billion-pound pace of reductions in its bond holdings. The BoE repeated its view that these sales had a limited impact on the gilt market and said the high level of interest rates would allow it to fine-tune monetary conditions if it proved greater in future."
https://www.investing.com/news/economy-news/us-construction-spending-extends-decline-in-june-3549435,"WASHINGTON (Reuters) - U.S. construction spending unexpectedly fell in June and the prior month's data was revised lower as higher mortgage rates weighed on single-family homebuilding. The Commerce Department's Census Bureau said on Thursday that construction spending dropped 0.3% after a downwardly revised 0.4% decline in May. Economists polled by Reuters had forecast construction spending rising 0.2% after a previously reported 0.1% dip in May. Construction spending advanced 6.2% year-on-year in June. Spending on private construction projects fell 0.3% in June after dropping 0.4% in the prior month. Investment in residential construction dropped 0.3% after falling 0.7% in May. Outlays on new single-family construction projects decreased 1.2%. Spending on multi-family housing gained 0.1%. Mortgage rates surged in the spring, depressing homebuilding and sales. Mortgage rates have since fallen and could decline further after the Federal Reserve on Wednesday kept its benchmark overnight interest rate in the 5.25%-5.50% range, where it has been since last July, but opened the door to reducing borrowing costs as soon as its next meeting in September. Rising housing inventory, with new single-family housing supply in June hitting the highest level since early 2008, could limit any rebound in new construction. Residential investment, which includes homebuilding and house sales, contracted in the second quarter after double-digit growth in the January-March quarter. In June, spending on private non-residential structures like factories dipped 0.1%. Investment in public construction projects fell 0.4% after slipping 0.2% in May. State and local government spending was unchanged and outlays on federal government projects declined 5.4%."
https://www.investing.com/news/economy-news/canada-cuts-boj-and-russia-hike-as-other-cenbanks-dither-in-july-3549351,"By Rodrigo Campos and Sumanta Sen NEW YORK (Reuters) - The Bank of Japan hiked its key interest rate for just the second time since 2007 and the Bank of Canada cut rates for the second month in a row, while the U.S. Federal Reserve stayed put in July. Among emerging economies, July saw Russia's central bank hike its benchmark rate by 200 basis points (bps) to the highest level in over two years, while Colombia's 50 bps cut was the largest last month, with China and Hungary also lowering rates. Five of the central banks overseeing the 10 most heavily traded currencies held meetings in July, with Japan hiking rates to 0.25% and Canada easing another 25 bps to reach 4.5%. The Bank of England cut interest rates on Thursday in a narrow vote by 25 bps to 5% - the first move of the August tally. The U.S. Fed, the European Central Bank, and the Reserve Bank of New Zealand held rates steady in July, with the Fed and RBNZ leaving the door open to rate cuts in the near future, data depending. This year through July, developed economies posted a total of 35 bps in hikes, all out of Japan, while six rate cuts elsewhere have amounted for 150 bps in policy easing. A rate cut of at least 25 bps is fully priced in for the Fed's September meeting after Chair Jerome Powell said it could come as early as next month, with the Fed focusing equally on lowering inflation and its full employment mandate. ""With the likely timing and size of the first (Fed) cut well communicated, the tougher question becomes the pace of cuts thereafter,"" said JPMorgan's Michael Feroli in a client note. ""So the shift in risk balance should clear the way not only for the first ease but potentially a long series of eases."" Thirteen out of the Reuters sample of 18 central banks in developing economies held rate-setting meetings in July, with Colombia, Hungary, and China combining for a total of 85 bps in cuts. Only Russia hiked and the other nine left rates unchanged. Chile was among those staying put, opting not to cut rates for the first meeting in nine. ""We see risks to our near-term policy rate path as skewed toward the possibility of just one, rather than two, cuts over the rest of the year,"" said Goldman Sachs' Sergio Armella in a note. The latest moves in emerging markets took the tally of cuts since the start of the year to 1,260 bps across 26 moves. Total hikes over the same period stood at 975 bps in four actions, with Russia joining previous hikers Turkey and Indonesia."
https://www.investing.com/news/economy-news/turkey-says-it-coordinating-an-extensive-prisoner-swap-on-thursday-3549347,"ANKARA (Reuters) - The Turkish National Intelligence Agency (MIT) said it would coordinate an extensive prisoner swap on Thursday, amid signs of a major prisoner exchange between Russia and Belarus on one side and the United States, Germany and Slovenia on the other. ""A (prisoner) exchange operation will take place today under the coordination of our organisation,"" MIT said in a statement. ""Our organization has undertaken a major mediation role in this exchange operation, which is the most comprehensive of the recent period."""
https://www.investing.com/news/economy-news/ethiopian-local-authorities-crack-down-on-price-hikes-after-currency-float-3549343,"ADDIS ABABA (Reuters) - At least two Ethiopian local governments have ordered the closure of dozens of businesses found hiking prices of basic commodities after the central bank floated the national currency, officials said on Thursday. The Ethiopian birr weakened by 28% against the dollar this week after the central bank adopted a market-determined foreign exchange rate to secure a new International Monetary Fund lending programme and to put debt restructuring back on track. ""The businesses were caught making unreasonable price increases mostly on food items ... The stocks were imported before the new exchange rate,"" said Sewnet Ayele, a spokesperson for the Addis Ababa City Trade Bureau. Some 71 businesses have been affected by the closure order, Sewnet said. In Oromiya region, another 19 businesses were closed and three people detained, said Meseret Assefa, head of the Trade Bureau of Oromiya. ""Those whose business are closed were the ones who increased prices on items just immediately after the (exchange rate) announcement,"" Meseret said. The main commodity whose price has gone up is cooking oil, which is selling at 25%, or 300 birrs, more, said a trader in Addis Ababa, who did not wish to be named. Other commodities whose prices have gone up by a smaller margin include rice, said the trader. Although the removal of foreign exchange trading restrictions helped Ethiopia to clinch the IMF deal and funding from other creditors like the World Bank, some Ethiopian analysts fear it will cause price hikes that hit the poor hardest. The government and its development partners say the liberalisation will help the private sector make a bigger contribution to the economy and boost long-term growth."
